<?xml version="1.0" encoding="utf-8" ?>
<revival xmlns:xsi="http://www.w3.org/2001/XMLSchema-instance" xsi:noNamespaceSchemaLocation="ModSchema.xsd">
  <modification>
    <title>Revival SP modification</title>
    <version>2.0</version>
    <description>This is the base SP modification developed by the Revival team.</description>
    <url>http://www.hellgateaus.net</url>
    <type>required</type>
    <pack id="Default">
      <!--<file id="Game_Globals">
        <modify>
          <entity id="MaxLuckTugboat" value="55">
            <attribute id="IntValue">
              <replace>
                <integer>10000</integer>
              </replace>
            </attribute>
          </entity>
        </modify>
      </file>
      <file id="Item_Levels">
        <modify>
          <entity id="*">
            <attribute id="AugmentCostRare">
              <divide>
                <integer>2</integer>
              </divide>
            </attribute>
            <attribute id="AugmentCostLegendary">
              <divide>
                <integer>2</integer>
              </divide>
            </attribute>
          </entity>
        </modify>
      </file>-->
      <file id="Item_Quality">
        <modify>
          <entity id="Legendary" value="3">
            <attribute id="VendorRarity">
              <replace>
                <integer>4</integer>
              </replace>
            </attribute>
          </entity>
          <entity id="Mutant" value="4">
            <attribute id="ExtraScrapQuality">
              <replace>
                <integer>4</integer>
              </replace>
            </attribute>
          </entity>
          <entity id="Unique" value="5">
            <attribute id="VendorRarity">
              <replace>
                <integer>1</integer>
              </replace>
            </attribute>
            <attribute id="Price_Multiplier">
              <replace>
                <integer>21</integer>
              </replace>
            </attribute>
          </entity>
        </modify>
      </file>
      <!--<file id="Items">
        <modify>
          <entity id="SkillRetrainer" value="15">
            <attribute id="Quality">
              <replace>
                <integer>5</integer>
              </replace>
            </attribute>
          </entity>
        </modify>
      </file>-->
    </pack>
  </modification>
  <modification>
    <title>Elite for normal mode</title>
    <version>2.0</version>
    <description>Reduces elite mode characters difficulty to normal mode, while benefiting from additional multipliers.</description>
    <url>http://www.hellgateaus.net</url>
    <type>optional</type>
    <pack id="Default">
      <file id="Game_Globals">
        <modify>
          <entity id="EliteMonsterDamagePercent">
            <attribute id="FloatValue">
              <replace>
                <float>0</float>
              </replace>
            </attribute>
          </entity>
          <entity id="EliteMonsterSFXChancePercent">
            <attribute id="FloatValue">
              <replace>
                <float>0</float>
              </replace>
            </attribute>
          </entity>
          <entity id="ElitePlayerDamagePercent">
            <attribute id="FloatValue">
              <replace>
                <float>0</float>
              </replace>
            </attribute>
          </entity>
          <entity id="ElitePlayerSFXChancePercent">
            <attribute id="FloatValue">
              <replace>
                <float>0</float>
              </replace>
            </attribute>
          </entity>
        </modify>
      </file>
    </pack>
  </modification>
</revival>